[{"schema_version":2,"id":"id-stage1b-0001","deck":"jft_ssw_work_japan","pack":"stage1b_id_validation","stage":"stage1b","tier":"free_validation","mode":"recognition","question_type":"vocab","target":"在留カード","reading":"ざいりゅうカード","meaning":{"id":"kartu izin tinggal","en":"residence card"},"example":{"ja":"受付で在留カードを出します。"},"exam_alignment":"JFT-Basic / SSW work-life","jft_section":"script_vocabulary","skill_category":"word_meaning","scenario":"city_office_residence_documents","tags":["stage1b","indonesian","english_fallback","recognition","script_vocabulary","word_meaning","city_office_residence_documents","jft_basic","ssw_work_life","documents"],"priority_weight":0.78,"paid_pack_potential":"paid_starter_core","review_status":{"japanese":"draft_needs_native_check","indonesian":"machine_draft_needs_human_review","english":"draft_needs_review","audio":"not_added","overall":"review"},"audio":{"target":null,"example":null,"voice":null,"status":"not_added","needs_recording":false,"review_status":"not_applicable"},"source_note":"Original Stage 1B draft content for this project. Public exam/Irodori/JF/SSW materials are used only for structure, domains, task types, and level expectations; no official/sample/textbook content is copied.","romaji":"zairyu kaado","usage_note":{"en":"Key document word for city office, clinic, and workplace onboarding situations."}},{"schema_version":2,"id":"id-stage1b-0002","deck":"jft_ssw_work_japan","pack":"stage1b_id_validation","stage":"stage1b","tier":"free_validation","mode":"recognition","question_type":"vocab","target":"住所変更","reading":"じゅうしょへんこう","meaning":{"id":"perubahan alamat","en":"address change"},"example":{"ja":"引っ越したら住所変更をします。"},"exam_alignment":"JFT-Basic / SSW work-life","jft_section":"script_vocabulary","skill_category":"word_usage","scenario":"city_office_residence_documents","tags":["stage1b","indonesian","english_fallback","recognition","script_vocabulary","word_usage","city_office_residence_documents","jft_basic","ssw_work_life","documents"],"priority_weight":0.78,"paid_pack_potential":"paid_starter_core","review_status":{"japanese":"draft_needs_native_check","indonesian":"machine_draft_needs_human_review","english":"draft_needs_review","audio":"not_added","overall":"review"},"audio":{"target":null,"example":null,"voice":null,"status":"not_added","needs_recording":false,"review_status":"not_applicable"},"source_note":"Original Stage 1B draft content for this project. Public exam/Irodori/JF/SSW materials are used only for structure, domains, task types, and level expectations; no official/sample/textbook content is copied.","romaji":"jusho henko","usage_note":{"en":"Useful for resident registration and moving procedures."}},{"schema_version":2,"id":"id-stage1b-0003","deck":"jft_ssw_work_japan","pack":"stage1b_id_validation","stage":"stage1b","tier":"free_validation","mode":"recognition","question_type":"vocab","target":"健康保険証","reading":"けんこうほけんしょう","meaning":{"id":"kartu asuransi kesehatan","en":"health insurance card"},"example":{"ja":"病院で健康保険証を使います。"},"exam_alignment":"JFT-Basic / SSW work-life","jft_section":"script_vocabulary","skill_category":"word_meaning","scenario":"health_insurance_documents","tags":["stage1b","indonesian","english_fallback","recognition","script_vocabulary","word_meaning","health_insurance_documents","jft_basic","ssw_work_life","documents"],"priority_weight":0.78,"paid_pack_potential":"paid_starter_core","review_status":{"japanese":"draft_needs_native_check","indonesian":"machine_draft_needs_human_review","english":"draft_needs_review","audio":"not_added","overall":"review"},"audio":{"target":null,"example":null,"voice":null,"status":"not_added","needs_recording":false,"review_status":"not_applicable"},"source_note":"Original Stage 1B draft content for this project. Public exam/Irodori/JF/SSW materials are used only for structure, domains, task types, and level expectations; no official/sample/textbook content is copied.","romaji":"kenko hokensho","usage_note":{"en":"Practical health-care document vocabulary for living in Japan."}},{"schema_version":2,"id":"id-stage1b-0004","deck":"jft_ssw_work_japan","pack":"stage1b_id_validation","stage":"stage1b","tier":"free_validation","mode":"recognition","question_type":"vocab","target":"作業","reading":"さぎょう","meaning":{"id":"pekerjaan; tugas kerja","en":"work task"},"example":{"ja":"朝の作業を始めます。"},"exam_alignment":"JFT-Basic / SSW work-life","jft_section":"script_vocabulary","skill_category":"word_meaning","scenario":"workplace_task","tags":["stage1b","indonesian","english_fallback","recognition","script_vocabulary","word_meaning","workplace_task","jft_basic","ssw_work_life","workplace"],"priority_weight":0.78,"paid_pack_potential":"field_specific_seed","review_status":{"japanese":"draft_needs_native_check","indonesian":"machine_draft_needs_human_review","english":"draft_needs_review","audio":"not_added","overall":"review"},"audio":{"target":null,"example":null,"voice":null,"status":"not_added","needs_recording":false,"review_status":"not_applicable"},"source_note":"Original Stage 1B draft content for this project. Public exam/Irodori/JF/SSW materials are used only for structure, domains, task types, and level expectations; no official/sample/textbook content is copied.","romaji":"sagyo","usage_note":{"en":"Common word in workplace instructions and task notes."}},{"schema_version":2,"id":"id-stage1b-0005","deck":"jft_ssw_work_japan","pack":"stage1b_id_validation","stage":"stage1b","tier":"free_validation","mode":"recognition","question_type":"vocab","target":"シフト表","reading":"シフトひょう","meaning":{"id":"daftar jadwal shift","en":"shift schedule"},"example":{"ja":"シフト表を見ます。"},"exam_alignment":"JFT-Basic / SSW work-life","jft_section":"script_vocabulary","skill_category":"word_meaning","scenario":"schedule_shifts_time","tags":["stage1b","indonesian","english_fallback","recognition","script_vocabulary","word_meaning","schedule_shifts_time","jft_basic","ssw_work_life"],"priority_weight":0.78,"paid_pack_potential":"paid_starter_core","review_status":{"japanese":"draft_needs_native_check","indonesian":"machine_draft_needs_human_review","english":"draft_needs_review","audio":"not_added","overall":"review"},"audio":{"target":null,"example":null,"voice":null,"status":"not_added","needs_recording":false,"review_status":"not_applicable"},"source_note":"Original Stage 1B draft content for this project. Public exam/Irodori/JF/SSW materials are used only for structure, domains, task types, and level expectations; no official/sample/textbook content is copied.","romaji":"shifuto-hyo","usage_note":{"en":"Supports work scheduling, lateness prevention, and time planning."}},{"schema_version":2,"id":"id-stage1b-0006","deck":"jft_ssw_work_japan","pack":"stage1b_id_validation","stage":"stage1b","tier":"free_validation","mode":"recognition","question_type":"vocab","target":"予約","reading":"よやく","meaning":{"id":"janji temu; reservasi","en":"appointment; reservation"},"example":{"ja":"病院の予約があります。"},"exam_alignment":"JFT-Basic / SSW work-life","jft_section":"script_vocabulary","skill_category":"word_usage","scenario":"appointment_reservation","tags":["stage1b","indonesian","english_fallback","recognition","script_vocabulary","word_usage","appointment_reservation","jft_basic","ssw_work_life"],"priority_weight":0.72,"paid_pack_potential":"free_validation","review_status":{"japanese":"draft_needs_native_check","indonesian":"machine_draft_needs_human_review","english":"draft_needs_review","audio":"not_added","overall":"review"},"audio":{"target":null,"example":null,"voice":null,"status":"not_added","needs_recording":false,"review_status":"not_applicable"},"source_note":"Original Stage 1B draft content for this project. Public exam/Irodori/JF/SSW materials are used only for structure, domains, task types, and level expectations; no official/sample/textbook content is copied.","romaji":"yoyaku","usage_note":{"en":"Useful for clinics, city office appointments, and services."}},{"schema_version":2,"id":"id-stage1b-0007","deck":"jft_ssw_work_japan","pack":"stage1b_id_validation","stage":"stage1b","tier":"free_validation","mode":"recognition","question_type":"vocab","target":"注意","reading":"ちゅうい","meaning":{"id":"perhatian; hati-hati","en":"caution; attention"},"example":{"ja":"注意の紙を読みます。"},"exam_alignment":"JFT-Basic / SSW work-life","jft_section":"script_vocabulary","skill_category":"word_meaning","scenario":"safety_warning_instructions","tags":["stage1b","indonesian","english_fallback","recognition","script_vocabulary","word_meaning","safety_warning_instructions","jft_basic","ssw_work_life","safety"],"priority_weight":0.78,"paid_pack_potential":"field_specific_seed","review_status":{"japanese":"draft_needs_native_check","indonesian":"machine_draft_needs_human_review","english":"draft_needs_review","audio":"not_added","overall":"review"},"audio":{"target":null,"example":null,"voice":null,"status":"not_added","needs_recording":false,"review_status":"not_applicable"},"source_note":"Original Stage 1B draft content for this project. Public exam/Irodori/JF/SSW materials are used only for structure, domains, task types, and level expectations; no official/sample/textbook content is copied.","romaji":"chui","usage_note":{"en":"Safety word that appears on signs, notices, and instructions."}},{"schema_version":2,"id":"id-stage1b-0008","deck":"jft_ssw_work_japan","pack":"stage1b_id_validation","stage":"stage1b","tier":"free_validation","mode":"recognition","question_type":"vocab","target":"上司","reading":"じょうし","meaning":{"id":"atasan","en":"supervisor"},"example":{"ja":"上司に連絡します。"},"exam_alignment":"JFT-Basic / SSW work-life","jft_section":"script_vocabulary","skill_category":"word_meaning","scenario":"workplace_communication","tags":["stage1b","indonesian","english_fallback","recognition","script_vocabulary","word_meaning","workplace_communication","jft_basic","ssw_work_life","workplace"],"priority_weight":0.78,"paid_pack_potential":"field_specif